User Input,Chatbot Response,Timestamp
hi,Hey,2025-03-12 21:50:29
What is credit score,"A credit score is a number that represents your creditworthiness. It is based on your credit history and is used by lenders to determine whether or not to lend you money. The higher your credit score, the more likely you are to be approved for credit.",2025-03-12 21:50:43
what is AI,I am a chatbot,2025-03-12 21:52:38
latest tech news,Technology is constantly evolving. Stay updated with tech blogs and news sites to know about the latest advancements!,2025-03-12 21:52:48
hi,Nothing much,2025-03-12 22:26:39
What is credit score,"A credit score is a number that represents your creditworthiness. It is based on your credit history and is used by lenders to determine whether or not to lend you money. The higher your credit score, the more likely you are to be approved for credit.",2025-03-12 22:29:01
latest tech news,Technology is constantly evolving. Stay updated with tech blogs and news sites to know about the latest advancements!,2025-03-12 22:29:38
